{
  "$schema": "https://json-schema.org/draft/2020-12/schema",
  "$id": "https://flow-as-code.dev/schema/scenario-0.1.schema.json",
  "title": "Simulate scenario 0.1",
  "description": "Authoring format for a flow simulation. This is not an Amazon Connect API shape: @flow-as-code/core compiles it into the Connect Testing language (a graph of Observations) that CreateTestCase takes as its Content string. See packages/core/src/simulate.ts and https://docs.aws.amazon.com/connect/latest/devguide/testing-language.html. The structural rules live here; the cross-field rules, including the live-agent safety rule, live in validateScenario.",
  "type": "object",
  "required": ["scenario", "name", "entryPoint", "steps"],
  "additionalProperties": false,
  "properties": {
    "scenario": {
      "const": "0.1"
    },
    "name": {
      "type": "string",
      "minLength": 1,
      "pattern": "^[a-z0-9]+(-[a-z0-9]+)*$"
    },
    "description": {
      "type": "string"
    },
    "entryPoint": {
      "$ref": "#/$defs/entryPoint"
    },
    "attributes": {
      "description": "Initial contact attributes. Serialized into the InitializationData JSON string.",
      "type": "object",
      "additionalProperties": {
        "type": "string"
      }
    },
    "steps": {
      "type": "array",
      "minItems": 1,
      "items": {
        "$ref": "#/$defs/step"
      }
    },
    "substitutions": {
      "type": "array",
      "items": {
        "$ref": "#/$defs/substitution"
      }
    },
    "endTest": {
      "description": "Append a TestControl EndTest action. Default true. A simulated contact that reaches a queue can connect to a live agent, so a scenario that expects a transfer must either end the test or substitute the queue.",
      "type": "boolean"
    }
  },
  "$defs": {
    "token": {
      "type": "string",
      "pattern": "^\\$\\{cdref:(queue|hours|lambda|lex|prompt|flow|module):[a-z0-9]+(-[a-z0-9]+)*(@[a-z0-9]+(-[a-z0-9]+)*)?\\}$"
    },
    "flowToken": {
      "type": "string",
      "pattern": "^\\$\\{cdref:flow:[a-z0-9]+(-[a-z0-9]+)*\\}$"
    },
    "queueToken": {
      "type": "string",
      "pattern": "^\\$\\{cdref:queue:[a-z0-9]+(-[a-z0-9]+)*\\}$"
    },
    "hoursToken": {
      "type": "string",
      "pattern": "^\\$\\{cdref:hours:[a-z0-9]+(-[a-z0-9]+)*\\}$"
    },
    "lambdaToken": {
      "type": "string",
      "pattern": "^\\$\\{cdref:lambda:[a-z0-9]+(-[a-z0-9]+)*\\}$"
    },
    "lexToken": {
      "type": "string",
      "pattern": "^\\$\\{cdref:lex:[a-z0-9]+(-[a-z0-9]+)*\\}$"
    },
    "jsonPath": {
      "type": "string",
      "pattern": "^\\$\\.[A-Za-z0-9_$.\\[\\]'-]+$"
    },
    "entryPoint": {
      "description": "TestCaseEntryPointType is CHAT or VOICE_CALL. The channel is a property of the entry point, not of an input. The flow token resolves to a contact flow id or ARN for FlowId; there is no destination number because CreateTestCase rejects a FlowId combined with a DestinationPhoneNumber. https://docs.aws.amazon.com/connect/latest/APIReference/API_VoiceCallEntryPointParameters.html",
      "type": "object",
      "required": ["channel", "flow"],
      "additionalProperties": false,
      "properties": {
        "channel": {
          "enum": ["voice", "chat"]
        },
        "flow": {
          "$ref": "#/$defs/flowToken"
        },
        "sourcePhoneNumber": {
          "description": "Voice only. E.164, as VoiceCallEntryPointParameters.SourcePhoneNumber requires. Defaults to the fictional +15550100.",
          "type": "string",
          "pattern": "^\\+[1-9]\\d{1,14}$"
        }
      },
      "if": {
        "properties": {
          "channel": {
            "const": "chat"
          }
        },
        "required": ["channel"]
      },
      "then": {
        "not": {
          "required": ["sourcePhoneNumber"]
        }
      }
    },
    "substitution": {
      "description": "OverrideSystemBehavior with a SubstituteResource strategy: swaps a production resource for a test one. actionParameters names the production resource under the key the action type reads (QueueId, HoursOfOperationId, LambdaFunctionARN); CreateTestCase rejects an empty ActionParameters. https://docs.aws.amazon.com/connect/latest/devguide/testing-language-actions-override-system-behavior.html",
      "type": "object",
      "required": ["actionType", "actionParameters", "substitute"],
      "additionalProperties": false,
      "properties": {
        "actionType": {
          "enum": ["TransferContactToQueue", "CheckHoursOfOperation", "InvokeLambdaFunction"]
        },
        "actionParameters": {
          "description": "Copied verbatim into Content, so every value is a token and never a literal. Which key the action type reads is a cross-field rule that lives in validateScenario.",
          "type": "object",
          "minProperties": 1,
          "additionalProperties": {
            "$ref": "#/$defs/token"
          }
        },
        "substitute": {
          "$ref": "#/$defs/token"
        }
      }
    },
    "step": {
      "oneOf": [
        {
          "type": "object",
          "required": ["kind"],
          "additionalProperties": false,
          "properties": {
            "kind": {
              "const": "expect-prompt"
            },
            "contains": {
              "type": "string",
              "minLength": 1
            },
            "similarTo": {
              "type": "string",
              "minLength": 1
            }
          },
          "oneOf": [
            {
              "required": ["contains"],
              "not": {
                "required": ["similarTo"]
              }
            },
            {
              "required": ["similarTo"],
              "not": {
                "required": ["contains"]
              }
            }
          ]
        },
        {
          "type": "object",
          "required": ["kind", "lambda"],
          "additionalProperties": false,
          "properties": {
            "kind": {
              "const": "expect-lambda"
            },
            "lambda": {
              "$ref": "#/$defs/lambdaToken"
            }
          }
        },
        {
          "type": "object",
          "required": ["kind", "queue"],
          "additionalProperties": false,
          "properties": {
            "kind": {
              "const": "expect-transfer"
            },
            "queue": {
              "$ref": "#/$defs/queueToken"
            }
          }
        },
        {
          "type": "object",
          "required": ["kind", "hours"],
          "additionalProperties": false,
          "properties": {
            "kind": {
              "const": "expect-hours-check"
            },
            "hours": {
              "$ref": "#/$defs/hoursToken"
            }
          }
        },
        {
          "type": "object",
          "required": ["kind", "lex"],
          "additionalProperties": false,
          "properties": {
            "kind": {
              "const": "expect-lex"
            },
            "lex": {
              "$ref": "#/$defs/lexToken"
            }
          }
        },
        {
          "type": "object",
          "required": ["kind", "name"],
          "additionalProperties": false,
          "properties": {
            "kind": {
              "const": "expect-queue"
            },
            "name": {
              "type": "string",
              "minLength": 1
            }
          }
        },
        {
          "type": "object",
          "required": ["kind", "path", "operator", "value"],
          "additionalProperties": false,
          "properties": {
            "kind": {
              "const": "assert"
            },
            "path": {
              "$ref": "#/$defs/jsonPath"
            },
            "operator": {
              "enum": [
                "Equals",
                "TextStartsWith",
                "TextEndsWith",
                "TextContains",
                "NumberGreaterThan",
                "NumberGreaterOrEqualTo",
                "NumberLessThan",
                "NumberLessOrEqualTo"
              ]
            },
            "value": {
              "type": "string"
            }
          }
        },
        {
          "type": "object",
          "required": ["kind", "value"],
          "additionalProperties": false,
          "properties": {
            "kind": {
              "const": "send-dtmf"
            },
            "value": {
              "type": "string",
              "pattern": "^[0-9*#]+$"
            }
          }
        },
        {
          "type": "object",
          "required": ["kind", "text"],
          "additionalProperties": false,
          "properties": {
            "kind": {
              "const": "send-speech"
            },
            "text": {
              "type": "string",
              "minLength": 1
            },
            "languageCode": {
              "type": "string"
            }
          }
        },
        {
          "type": "object",
          "required": ["kind", "text"],
          "additionalProperties": false,
          "properties": {
            "kind": {
              "const": "send-text"
            },
            "text": {
              "type": "string",
              "minLength": 1
            }
          }
        },
        {
          "type": "object",
          "required": ["kind"],
          "additionalProperties": false,
          "properties": {
            "kind": {
              "const": "disconnect"
            }
          }
        }
      ]
    }
  }
}
